{
  "$schema": "https://json-schema.org/draft/2020-12/schema",
  "$id": "https://contextlayer.dev/schemas/snapshot/v1.json",
  "type": "object",
  "required": ["snapshot_version", "system", "system_class",
               "source_mode", "captured_at", "connector", "objects"],
  "additionalProperties": false,
  "properties": {
    "snapshot_version": { "const": "1" },
    "system": { "type": "string", "minLength": 1 },
    "system_class": { "enum": ["sql", "api"] },
    "source_mode": { "enum": ["ddl-file", "live", "api"] },
    "captured_at": { "type": "string", "format": "date-time" },
    "connector": {
      "type": "object",
      "required": ["name", "version"],
      "additionalProperties": false,
      "properties": { "name": {"type": "string"}, "version": {"type": "string"} }
    },
    "source_properties": { "type": "object" },
    "objects": { "type": "array", "items": { "$ref": "#/$defs/object" } }
  },
  "$defs": {
    "object": {
      "type": "object",
      "required": ["kind", "schema", "name", "description",
                   "schema_hash", "columns", "keys", "stats"],
      "additionalProperties": false,
      "properties": {
        "kind": { "type": "string", "minLength": 1 },
        "schema": { "type": "string", "minLength": 1 },
        "name": { "type": "string", "minLength": 1 },
        "description": { "type": ["string", "null"] },
        "schema_hash": { "type": "string", "pattern": "^sha256:[0-9a-f]{64}$" },
        "columns": { "type": "array", "items": { "$ref": "#/$defs/column" } },
        "keys": {
          "type": "object",
          "additionalProperties": false,
          "properties": {
            "primary": { "type": "array", "items": {"type": "string"} },
            "foreign": { "type": "array", "items": { "$ref": "#/$defs/fk" } },
            "unique":  { "type": "array",
                         "items": { "type": "array", "items": {"type": "string"} } }
          }
        },
        "stats": { "type": "object" }
      }
    },
    "column": {
      "type": "object",
      "required": ["name", "type", "nullable", "default", "ordinal", "description"],
      "additionalProperties": false,
      "properties": {
        "name": { "type": "string", "minLength": 1 },
        "type": { "type": "string", "minLength": 1 },
        "nullable": { "type": "boolean" },
        "default": { "type": ["string", "null"] },
        "ordinal": { "type": "integer", "minimum": 1 },
        "description": { "type": ["string", "null"] }
      }
    },
    "fk": {
      "type": "object",
      "required": ["columns", "ref", "ref_columns"],
      "additionalProperties": false,
      "properties": {
        "columns": { "type": "array", "items": {"type": "string"}, "minItems": 1 },
        "ref": { "type": "string", "pattern": "^[^.]+\\.[^.]+$" },
        "ref_columns": { "type": "array", "items": {"type": "string"}, "minItems": 1 }
      }
    }
  }
}
