{"captured_at":"2026-07-12T23:20:54Z","connector":{"name":"postgres","version":"0.1.0"},"objects":[{"columns":[{"default":null,"description":null,"name":"user_id","nullable":true,"ordinal":1,"type":"uuid"},{"default":null,"description":null,"name":"ltv_cents","nullable":true,"ordinal":2,"type":"bigint"},{"default":null,"description":null,"name":"first_order_at","nullable":true,"ordinal":3,"type":"timestamp with time zone"},{"default":null,"description":null,"name":"last_order_at","nullable":true,"ordinal":4,"type":"timestamp with time zone"}],"description":"Lifetime value per user; refreshed nightly by pg_cron.","keys":{},"kind":"materialized_view","name":"mv_user_ltv","schema":"public","schema_hash":"sha256:3e21e9ad0fd4ad1b6d8ca0481e44ce2310924acf2fad374a58aa27a6a0b80048","stats":{"definition":" SELECT o.user_id,\n    sum(o.total_cents) AS ltv_cents,\n    min(o.created_at) AS first_order_at,\n    max(o.created_at) AS last_order_at\n   FROM public.orders o\n  WHERE o.status = 'paid'::text\n  GROUP BY o.user_id;"}},{"columns":[{"default":"nextval('public.order_items_id_seq'::regclass)","description":null,"name":"id","nullable":false,"ordinal":1,"type":"bigint"},{"default":null,"description":null,"name":"order_id","nullable":false,"ordinal":2,"type":"bigint"},{"default":null,"description":null,"name":"product_id","nullable":false,"ordinal":3,"type":"bigint"},{"default":"1","description":null,"name":"quantity","nullable":false,"ordinal":4,"type":"integer"},{"default":null,"description":"Price at time of purchase; the product price may change later.","name":"unit_price_cents","nullable":false,"ordinal":5,"type":"integer"}],"description":null,"keys":{"foreign":[{"columns":["order_id"],"ref":"public.orders","ref_columns":["id"]},{"columns":["product_id"],"ref":"public.products","ref_columns":["id"]}],"primary":["id"],"unique":[["order_id","product_id"]]},"kind":"table","name":"order_items","schema":"public","schema_hash":"sha256:9456bc9f8ab7e1bd284f874b057e17304d423a1674f9f6ea7af2639b48d05d9d","stats":{}},{"columns":[{"default":"nextval('public.orders_id_seq'::regclass)","description":null,"name":"id","nullable":false,"ordinal":1,"type":"bigint"},{"default":null,"description":null,"name":"user_id","nullable":false,"ordinal":2,"type":"uuid"},{"default":"'pending'::text","description":"pending | paid | cancelled | refunded","name":"status","nullable":false,"ordinal":3,"type":"text"},{"default":null,"description":"Grand total in cents, tax included.","name":"total_cents","nullable":false,"ordinal":4,"type":"integer"},{"default":null,"description":null,"name":"notes","nullable":true,"ordinal":5,"type":"text"},{"default":"now()","description":null,"name":"created_at","nullable":false,"ordinal":6,"type":"timestamp with time zone"}],"description":"One row per checkout; immutable after payment settles.","keys":{"foreign":[{"columns":["user_id"],"ref":"public.users","ref_columns":["id"]}],"primary":["id"]},"kind":"table","name":"orders","schema":"public","schema_hash":"sha256:c108a3ef942b6e8dc01255ea7b01f85c229fe57b6f8d5db1765beca1d213964d","stats":{}},{"columns":[{"default":"nextval('public.products_id_seq'::regclass)","description":null,"name":"id","nullable":false,"ordinal":1,"type":"bigint"},{"default":null,"description":null,"name":"sku","nullable":false,"ordinal":2,"type":"text"},{"default":null,"description":null,"name":"name","nullable":false,"ordinal":3,"type":"text"},{"default":null,"description":"Current list price in cents.","name":"price_cents","nullable":false,"ordinal":4,"type":"integer"},{"default":null,"description":null,"name":"discontinued_at","nullable":true,"ordinal":5,"type":"timestamp with time zone"}],"description":null,"keys":{"primary":["id"],"unique":[["sku"]]},"kind":"table","name":"products","schema":"public","schema_hash":"sha256:2c4b1dbefb47f02ff364120690d31364fe990e1d871ddadcdd8283d87705b19f","stats":{}},{"columns":[{"default":"gen_random_uuid()","description":null,"name":"id","nullable":false,"ordinal":1,"type":"uuid"},{"default":null,"description":"Lowercased at the application layer; citext migration pending.","name":"email","nullable":false,"ordinal":2,"type":"text"},{"default":null,"description":null,"name":"full_name","nullable":true,"ordinal":3,"type":"text"},{"default":"now()","description":null,"name":"created_at","nullable":false,"ordinal":4,"type":"timestamp with time zone"},{"default":null,"description":"Soft-delete marker; NULL means active.","name":"deleted_at","nullable":true,"ordinal":5,"type":"timestamp with time zone"}],"description":"Registered accounts. Rows are soft-deleted via deleted_at.","keys":{"primary":["id"],"unique":[["email"]]},"kind":"table","name":"users","schema":"public","schema_hash":"sha256:6fa6f398726cb2d0a8d7c510c23e15068a567fab80a6bf144da2290c09ad3f54","stats":{}},{"columns":[{"default":null,"description":null,"name":"day","nullable":true,"ordinal":1,"type":"timestamp with time zone"},{"default":null,"description":null,"name":"revenue_cents","nullable":true,"ordinal":2,"type":"bigint"},{"default":null,"description":null,"name":"order_count","nullable":true,"ordinal":3,"type":"bigint"}],"description":"Paid revenue per calendar day. Used by the Looker Studio P&L page.","keys":{},"kind":"view","name":"v_daily_revenue","schema":"public","schema_hash":"sha256:218f7bbc0c104e79e587afbda271ce81500dac689c8da5ee38c236139685af88","stats":{"definition":" SELECT date_trunc('day'::text, o.created_at) AS day,\n    sum(o.total_cents) AS revenue_cents,\n    count(*) AS order_count\n   FROM public.orders o\n  WHERE o.status = 'paid'::text\n  GROUP BY (date_trunc('day'::text, o.created_at));"}}],"snapshot_version":"1","source_mode":"ddl-file","source_properties":{"server_version":"15.18"},"system":"supabase","system_class":"sql"}
