{"captured_at":"2026-07-12T23:33:21Z","connector":{"name":"gsc","version":"0.1.0"},"objects":[{"columns":[],"description":null,"keys":{},"kind":"api_dimension","name":"country","schema":"standard","schema_hash":"sha256:55919ee17ec1d72c8388b42800e3c3de2ab9dbfe67873401c50667e9211f0038","stats":{"data_type":"string"}},{"columns":[],"description":null,"keys":{},"kind":"api_dimension","name":"date","schema":"standard","schema_hash":"sha256:f6fe2ccc543ab7ff53f94e6016e5aa7b95b8011268779f5fc6685c66d0ad2404","stats":{"data_type":"string"}},{"columns":[],"description":null,"keys":{},"kind":"api_dimension","name":"device","schema":"standard","schema_hash":"sha256:1e65881d73133a6d7870072a2a639a1c6e58e6e41c174f2af63337cdbd0d11a6","stats":{"data_type":"string"}},{"columns":[],"description":null,"keys":{},"kind":"api_dimension","name":"page","schema":"standard","schema_hash":"sha256:320342b0d14b7085fad016177e485be80d2b5fc70818a91a86d0b49973df425f","stats":{"data_type":"string"}},{"columns":[],"description":null,"keys":{},"kind":"api_dimension","name":"query","schema":"standard","schema_hash":"sha256:2a51080b1f57df5ea6248d489b8c0a2838d34485b631d38bf25bc693740a82f5","stats":{"data_type":"string"}},{"columns":[],"description":null,"keys":{},"kind":"api_dimension","name":"searchAppearance","schema":"standard","schema_hash":"sha256:5016f7987a62ff099ff08939f4d340adbe60895f195bc635d9e4167265ce5f01","stats":{"data_type":"string"}},{"columns":[],"description":null,"keys":{},"kind":"api_metric","name":"clicks","schema":"standard","schema_hash":"sha256:048520872d9e025cc7e45a41492dbf7079717167d07bf9a0f4af36f3b7b03583","stats":{"data_type":"integer"}},{"columns":[],"description":null,"keys":{},"kind":"api_metric","name":"ctr","schema":"standard","schema_hash":"sha256:39bcba6c1dba4ae13b842c3a2f315b71cf9c82ef8880f9ab006a93adc08a804d","stats":{"data_type":"double"}},{"columns":[],"description":null,"keys":{},"kind":"api_metric","name":"impressions","schema":"standard","schema_hash":"sha256:00ee65b645b2c93880b1a5d18636156fbba3df8570f96e5f5559688e33a303f8","stats":{"data_type":"integer"}},{"columns":[],"description":null,"keys":{},"kind":"api_metric","name":"position","schema":"standard","schema_hash":"sha256:d9e97a288e6d80dcdcfb1fbd886cdbb48ef9a4da19cdc2ba7a53b46db38757ea","stats":{"data_type":"double"}}],"snapshot_version":"1","source_mode":"api","source_properties":{"data_freshness":{"data_states":["all","final"]},"properties":[{"permission_level":"siteRestrictedUser","site_url":"sc-domain:jobspecificcv.com","verified":true}]},"system":"gsc","system_class":"api"}
