{
  "captured_at": "2026-07-11T02:10:00Z",
  "connector": {
    "name": "ga4",
    "version": "0.1.0"
  },
  "objects": [
    {
      "columns": [],
      "description": "The country from which the user activity originated.",
      "keys": {},
      "kind": "api_dimension",
      "name": "country",
      "schema": "standard",
      "schema_hash": "sha256:55919ee17ec1d72c8388b42800e3c3de2ab9dbfe67873401c50667e9211f0038",
      "stats": {
        "data_type": "string"
      }
    },
    {
      "columns": [],
      "description": "The type of device: Desktop, Tablet, or Mobile.",
      "keys": {},
      "kind": "api_dimension",
      "name": "deviceCategory",
      "schema": "standard",
      "schema_hash": "sha256:cc41193261a64d991063c42ca746ba88c73fb847e30d74a1ca65c3d1d717a3e8",
      "stats": {
        "data_type": "string"
      }
    },
    {
      "columns": [],
      "description": "The date of the event, formatted as YYYYMMDD.",
      "keys": {},
      "kind": "api_dimension",
      "name": "date",
      "schema": "standard",
      "schema_hash": "sha256:f6fe2ccc543ab7ff53f94e6016e5aa7b95b8011268779f5fc6685c66d0ad2404",
      "stats": {
        "data_type": "string"
      }
    },
    {
      "columns": [],
      "description": "Subscription tier attached to checkout events.",
      "keys": {},
      "kind": "api_dimension",
      "name": "customEvent:plan_tier",
      "schema": "custom",
      "schema_hash": "sha256:98215b98b375fed80a438f7126ff46a401700bc62311e4f7bb7bd65e3faf807f",
      "stats": {
        "data_type": "string"
      }
    },
    {
      "columns": [],
      "description": "CRM identifier synced from the sales pipeline.",
      "keys": {},
      "kind": "api_dimension",
      "name": "customUser:crm_id",
      "schema": "custom",
      "schema_hash": "sha256:990a864b3ccfde13a7b4e3003f7237a7779335c4a2efcee77c855f98a4b5a5bb",
      "stats": {
        "data_type": "string"
      }
    },
    {
      "columns": [],
      "description": "The number of distinct users who visited your site or app.",
      "keys": {},
      "kind": "api_metric",
      "name": "activeUsers",
      "schema": "standard",
      "schema_hash": "sha256:fcebb45cf4555d5cd4540c217b0ec521f2498f3e936796270d321df891f187f4",
      "stats": {
        "data_type": "TYPE_INTEGER"
      }
    },
    {
      "columns": [],
      "description": "The number of sessions that began on your site or app.",
      "keys": {},
      "kind": "api_metric",
      "name": "sessions",
      "schema": "standard",
      "schema_hash": "sha256:c212a9134cf2eb4a24629c481de9c9070dfde9e833543e4a07d2bb2b2f62a38a",
      "stats": {
        "data_type": "TYPE_INTEGER"
      }
    },
    {
      "columns": [],
      "description": "The sum of revenue from purchases, subscriptions, and advertising.",
      "keys": {},
      "kind": "api_metric",
      "name": "totalRevenue",
      "schema": "standard",
      "schema_hash": "sha256:67a86e18cf083feee09228b82bdc7451438aa432b7c7412a0cd5ff33bfdc7cbe",
      "stats": {
        "data_type": "TYPE_CURRENCY"
      }
    },
    {
      "columns": [],
      "description": "Count of support tickets opened from the in-app widget.",
      "keys": {},
      "kind": "api_metric",
      "name": "customEvent:support_tickets",
      "schema": "custom",
      "schema_hash": "sha256:f7bb3e5b6743c7599a47b817ca362a18eb362702fe7d4e3f0f1380826cdc1e14",
      "stats": {
        "data_type": "TYPE_INTEGER",
        "scope": "EVENT"
      }
    },
    {
      "columns": [],
      "description": "Calculated metric: total revenue divided by active users.",
      "keys": {},
      "kind": "api_metric",
      "name": "calcMetric:revenue_per_user",
      "schema": "custom",
      "schema_hash": "sha256:a3c5d147e153a79819b7bb34f98bd853e923b74d2c34f5e275965e1bf6d22f1e",
      "stats": {
        "data_type": "TYPE_CURRENCY",
        "formula": "totalRevenue/activeUsers"
      }
    },
    {
      "columns": [],
      "description": "Fires on every page load or history state change.",
      "keys": {},
      "kind": "api_event",
      "name": "page_view",
      "schema": "standard",
      "schema_hash": "sha256:26af3d54759dd2a2b763d20ea1b71cd7df5853f06847cb5c5997197e64ebba0a",
      "stats": {
        "is_key_event": false
      }
    },
    {
      "columns": [],
      "description": null,
      "keys": {},
      "kind": "api_event",
      "name": "session_start",
      "schema": "standard",
      "schema_hash": "sha256:5ef598a7a92de92e86a5f6987dbb4ea850ae3c079af1ef67746d21f585ba6942",
      "stats": {
        "is_key_event": false
      }
    },
    {
      "columns": [
        {
          "default": null,
          "description": "The unique identifier of the transaction.",
          "name": "transaction_id",
          "nullable": true,
          "ordinal": 1,
          "type": "string"
        },
        {
          "default": null,
          "description": "The monetary value of the event.",
          "name": "value",
          "nullable": true,
          "ordinal": 2,
          "type": "number"
        },
        {
          "default": null,
          "description": "Currency of the event, in 3-letter ISO 4217 format.",
          "name": "currency",
          "nullable": true,
          "ordinal": 3,
          "type": "string"
        }
      ],
      "description": "A purchase was completed.",
      "keys": {},
      "kind": "api_event",
      "name": "purchase",
      "schema": "standard",
      "schema_hash": "sha256:27aeac1f752ea342f1f85b5482c606402e8b0c1128e291abd68e41919bb363d7",
      "stats": {
        "is_key_event": true
      }
    },
    {
      "columns": [],
      "description": "Sent when onboarding finishes.",
      "keys": {},
      "kind": "api_event",
      "name": "sign_up_completed",
      "schema": "custom",
      "schema_hash": "sha256:6f2466add0fde754c25d3dcd8121c19b90134594433c9eed357cb9681384363f",
      "stats": {
        "is_key_event": true
      }
    },
    {
      "columns": [],
      "description": null,
      "keys": {},
      "kind": "api_event",
      "name": "plan_upgraded",
      "schema": "custom",
      "schema_hash": "sha256:b1587465edc46aacf62cb11097e2cb5cb0cb4a0938b5ea15d16c4b8377f7342b",
      "stats": {
        "is_key_event": false
      }
    }
  ],
  "snapshot_version": "1",
  "source_mode": "api",
  "source_properties": {
    "currency_code": "TRY",
    "display_name": "Acme Store — Web",
    "property_id": "properties/313459823",
    "time_zone": "Europe/Istanbul"
  },
  "system": "ga4",
  "system_class": "api"
}
